{
  "$schema": "https://json-schema.org/draft/2020-12/schema",
  "type": "object",
  "properties": {
    "version": {
      "type": "number",
      "const": 3
    },
    "noteId": {
      "type": "string"
    },
    "intents": {
      "type": "array",
      "items": {
        "type": "string",
        "enum": [
          "record",
          "question",
          "goal",
          "correction",
          "chat"
        ]
      }
    },
    "creates": {
      "type": "array",
      "items": {
        "type": "object",
        "properties": {
          "day": {
            "type": "string",
            "pattern": "^\\d{4}-\\d{2}-\\d{2}$"
          },
          "data": {
            "oneOf": [
              {
                "type": "object",
                "properties": {
                  "kind": {
                    "type": "string",
                    "const": "event"
                  },
                  "category": {
                    "type": "string"
                  },
                  "label": {
                    "type": "string",
                    "minLength": 1
                  },
                  "start": {
                    "type": "string",
                    "pattern": "^\\d{4}-\\d{2}-\\d{2}T\\d{2}:\\d{2}$"
                  },
                  "end": {
                    "type": "string",
                    "pattern": "^\\d{4}-\\d{2}-\\d{2}T\\d{2}:\\d{2}$"
                  },
                  "durationMin": {
                    "type": "number",
                    "exclusiveMinimum": 0
                  },
                  "metrics": {
                    "default": [],
                    "type": "array",
                    "items": {
                      "type": "object",
                      "properties": {
                        "name": {
                          "type": "string",
                          "minLength": 1
                        },
                        "value": {
                          "type": "number"
                        },
                        "unit": {
                          "default": "",
                          "type": "string"
                        },
                        "item": {
                          "type": "string"
                        },
                        "for": {
                          "type": "string"
                        },
                        "from": {
                          "type": "string"
                        }
                      },
                      "required": [
                        "name",
                        "value",
                        "unit"
                      ],
                      "additionalProperties": false
                    }
                  },
                  "note": {
                    "type": "string"
                  },
                  "people": {
                    "default": [],
                    "type": "array",
                    "items": {
                      "type": "string"
                    }
                  },
                  "things": {
                    "default": [],
                    "type": "array",
                    "items": {
                      "type": "string"
                    }
                  },
                  "places": {
                    "default": [],
                    "type": "array",
                    "items": {
                      "type": "string"
                    }
                  }
                },
                "required": [
                  "kind",
                  "category",
                  "label",
                  "metrics",
                  "people",
                  "things",
                  "places"
                ],
                "additionalProperties": false
              },
              {
                "type": "object",
                "properties": {
                  "kind": {
                    "type": "string",
                    "const": "insight"
                  },
                  "title": {
                    "type": "string",
                    "minLength": 1
                  },
                  "quote": {
                    "type": "string",
                    "minLength": 1
                  },
                  "tags": {
                    "default": [],
                    "type": "array",
                    "items": {
                      "type": "string"
                    }
                  }
                },
                "required": [
                  "kind",
                  "title",
                  "quote",
                  "tags"
                ],
                "additionalProperties": false
              },
              {
                "type": "object",
                "properties": {
                  "kind": {
                    "type": "string",
                    "const": "todo"
                  },
                  "content": {
                    "type": "string",
                    "minLength": 1
                  },
                  "due": {
                    "type": "string",
                    "pattern": "^\\d{4}-\\d{2}-\\d{2}$"
                  },
                  "done": {
                    "default": false,
                    "type": "boolean"
                  },
                  "people": {
                    "default": [],
                    "type": "array",
                    "items": {
                      "type": "string"
                    }
                  },
                  "things": {
                    "default": [],
                    "type": "array",
                    "items": {
                      "type": "string"
                    }
                  },
                  "places": {
                    "default": [],
                    "type": "array",
                    "items": {
                      "type": "string"
                    }
                  }
                },
                "required": [
                  "kind",
                  "content",
                  "done",
                  "people",
                  "things",
                  "places"
                ],
                "additionalProperties": false
              },
              {
                "type": "object",
                "properties": {
                  "kind": {
                    "type": "string",
                    "const": "mood"
                  },
                  "level": {
                    "type": "integer",
                    "minimum": 1,
                    "maximum": 5
                  },
                  "tone": {
                    "type": "string",
                    "enum": [
                      "good",
                      "neutral",
                      "bad",
                      "mixed"
                    ]
                  },
                  "strength": {
                    "type": "string",
                    "enum": [
                      "weak",
                      "medium",
                      "strong"
                    ]
                  },
                  "energy": {
                    "type": "integer",
                    "minimum": 1,
                    "maximum": 5
                  },
                  "emotions": {
                    "default": [],
                    "type": "array",
                    "items": {
                      "type": "string"
                    }
                  },
                  "moment": {
                    "type": "string"
                  }
                },
                "required": [
                  "kind",
                  "level",
                  "emotions"
                ],
                "additionalProperties": false
              }
            ]
          },
          "span": {
            "default": "",
            "type": "string"
          },
          "confidence": {
            "type": "number",
            "minimum": 0,
            "maximum": 1
          },
          "question": {
            "type": "string"
          }
        },
        "required": [
          "day",
          "data",
          "span",
          "confidence"
        ],
        "additionalProperties": false
      }
    },
    "updates": {
      "default": [],
      "type": "array",
      "items": {
        "type": "object",
        "properties": {
          "id": {
            "type": "string",
            "minLength": 1
          },
          "action": {
            "type": "string",
            "enum": [
              "updated",
              "confirmed",
              "completed"
            ]
          },
          "day": {
            "type": "string",
            "pattern": "^\\d{4}-\\d{2}-\\d{2}$"
          },
          "data": {
            "oneOf": [
              {
                "type": "object",
                "properties": {
                  "kind": {
                    "type": "string",
                    "const": "event"
                  },
                  "category": {
                    "type": "string"
                  },
                  "label": {
                    "type": "string",
                    "minLength": 1
                  },
                  "start": {
                    "type": "string",
                    "pattern": "^\\d{4}-\\d{2}-\\d{2}T\\d{2}:\\d{2}$"
                  },
                  "end": {
                    "type": "string",
                    "pattern": "^\\d{4}-\\d{2}-\\d{2}T\\d{2}:\\d{2}$"
                  },
                  "durationMin": {
                    "type": "number",
                    "exclusiveMinimum": 0
                  },
                  "metrics": {
                    "default": [],
                    "type": "array",
                    "items": {
                      "type": "object",
                      "properties": {
                        "name": {
                          "type": "string",
                          "minLength": 1
                        },
                        "value": {
                          "type": "number"
                        },
                        "unit": {
                          "default": "",
                          "type": "string"
                        },
                        "item": {
                          "type": "string"
                        },
                        "for": {
                          "type": "string"
                        },
                        "from": {
                          "type": "string"
                        }
                      },
                      "required": [
                        "name",
                        "value",
                        "unit"
                      ],
                      "additionalProperties": false
                    }
                  },
                  "note": {
                    "type": "string"
                  },
                  "people": {
                    "default": [],
                    "type": "array",
                    "items": {
                      "type": "string"
                    }
                  },
                  "things": {
                    "default": [],
                    "type": "array",
                    "items": {
                      "type": "string"
                    }
                  },
                  "places": {
                    "default": [],
                    "type": "array",
                    "items": {
                      "type": "string"
                    }
                  }
                },
                "required": [
                  "kind",
                  "category",
                  "label",
                  "metrics",
                  "people",
                  "things",
                  "places"
                ],
                "additionalProperties": false
              },
              {
                "type": "object",
                "properties": {
                  "kind": {
                    "type": "string",
                    "const": "insight"
                  },
                  "title": {
                    "type": "string",
                    "minLength": 1
                  },
                  "quote": {
                    "type": "string",
                    "minLength": 1
                  },
                  "tags": {
                    "default": [],
                    "type": "array",
                    "items": {
                      "type": "string"
                    }
                  }
                },
                "required": [
                  "kind",
                  "title",
                  "quote",
                  "tags"
                ],
                "additionalProperties": false
              },
              {
                "type": "object",
                "properties": {
                  "kind": {
                    "type": "string",
                    "const": "todo"
                  },
                  "content": {
                    "type": "string",
                    "minLength": 1
                  },
                  "due": {
                    "type": "string",
                    "pattern": "^\\d{4}-\\d{2}-\\d{2}$"
                  },
                  "done": {
                    "default": false,
                    "type": "boolean"
                  },
                  "people": {
                    "default": [],
                    "type": "array",
                    "items": {
                      "type": "string"
                    }
                  },
                  "things": {
                    "default": [],
                    "type": "array",
                    "items": {
                      "type": "string"
                    }
                  },
                  "places": {
                    "default": [],
                    "type": "array",
                    "items": {
                      "type": "string"
                    }
                  }
                },
                "required": [
                  "kind",
                  "content",
                  "done",
                  "people",
                  "things",
                  "places"
                ],
                "additionalProperties": false
              },
              {
                "type": "object",
                "properties": {
                  "kind": {
                    "type": "string",
                    "const": "mood"
                  },
                  "level": {
                    "type": "integer",
                    "minimum": 1,
                    "maximum": 5
                  },
                  "tone": {
                    "type": "string",
                    "enum": [
                      "good",
                      "neutral",
                      "bad",
                      "mixed"
                    ]
                  },
                  "strength": {
                    "type": "string",
                    "enum": [
                      "weak",
                      "medium",
                      "strong"
                    ]
                  },
                  "energy": {
                    "type": "integer",
                    "minimum": 1,
                    "maximum": 5
                  },
                  "emotions": {
                    "default": [],
                    "type": "array",
                    "items": {
                      "type": "string"
                    }
                  },
                  "moment": {
                    "type": "string"
                  }
                },
                "required": [
                  "kind",
                  "level",
                  "emotions"
                ],
                "additionalProperties": false
              }
            ]
          },
          "span": {
            "default": "",
            "type": "string"
          },
          "confidence": {
            "type": "number",
            "minimum": 0,
            "maximum": 1
          },
          "question": {
            "type": "string"
          }
        },
        "required": [
          "id",
          "action",
          "day",
          "data",
          "span",
          "confidence"
        ],
        "additionalProperties": false
      }
    },
    "deletes": {
      "default": [],
      "type": "array",
      "items": {
        "type": "object",
        "properties": {
          "id": {
            "type": "string",
            "minLength": 1
          },
          "span": {
            "default": "",
            "type": "string"
          }
        },
        "required": [
          "id",
          "span"
        ],
        "additionalProperties": false
      }
    },
    "duplicates": {
      "default": [],
      "type": "array",
      "items": {
        "type": "object",
        "properties": {
          "id": {
            "type": "string",
            "minLength": 1
          },
          "span": {
            "default": "",
            "type": "string"
          }
        },
        "required": [
          "id",
          "span"
        ],
        "additionalProperties": false
      }
    },
    "questions": {
      "default": [],
      "type": "array",
      "items": {
        "type": "string"
      }
    },
    "newCategories": {
      "default": [],
      "type": "array",
      "items": {
        "type": "object",
        "properties": {
          "key": {
            "type": "string",
            "minLength": 1
          },
          "name": {
            "type": "string",
            "minLength": 1
          },
          "emoji": {
            "default": "",
            "type": "string"
          },
          "parent": {
            "type": [
              "string",
              "null"
            ]
          },
          "measure": {
            "default": "duration",
            "type": "string"
          },
          "synonyms": {
            "default": [],
            "type": "array",
            "items": {
              "type": "string"
            }
          },
          "color": {
            "default": "stone",
            "type": "string"
          },
          "order": {
            "default": 500,
            "type": "integer",
            "minimum": -9007199254740991,
            "maximum": 9007199254740991
          }
        },
        "required": [
          "key",
          "name",
          "emoji",
          "measure",
          "synonyms",
          "color",
          "order"
        ],
        "additionalProperties": false
      }
    },
    "skipped": {
      "default": [],
      "type": "array",
      "items": {
        "type": "string"
      }
    },
    "reply": {
      "type": "string"
    },
    "steps": {
      "type": "array",
      "items": {
        "type": "object",
        "properties": {
          "step": {
            "type": "string"
          },
          "skill": {
            "type": "string"
          },
          "skillVersion": {
            "type": "string"
          },
          "durationMs": {
            "type": "number"
          },
          "promptTokens": {
            "type": "number"
          },
          "cacheHitTokens": {
            "type": "number"
          },
          "completionTokens": {
            "type": "number"
          },
          "error": {
            "type": "string"
          }
        },
        "required": [
          "step",
          "durationMs"
        ],
        "additionalProperties": false
      }
    }
  },
  "required": [
    "version",
    "noteId",
    "intents",
    "creates",
    "updates",
    "deletes",
    "duplicates",
    "questions",
    "newCategories",
    "skipped",
    "reply",
    "steps"
  ],
  "additionalProperties": false
}
